Name,Website,Location,Tuition,Acceptance Rate,Student-Faculty Ratio,Description
St. Bonaventure University,https://www.collegexpress.com/college/st-bonaventure-university/1100041/details/,"St. Bonaventure, NY","$35,450",76%,12:1,"St. Bonaventure University, founded in 1858, is a private, coeducational  institution. Its 600-acre campus is located in Olean, 75 miles from Buffalo."
St. Francis College,https://www.collegexpress.com/college/st-francis-college/1100046/details/,"Brooklyn Heights, NY","$26,688",84%,,"St. Francis College is a private, church-affiliated, liberal arts college. Founded in 1884 with the purpose of providing higher education for students with limited economic resources, it adopted coeducation in 1969. Its urban campus is located in Brooklyn Heights."
St. John Fisher College,https://www.collegexpress.com/college/st-john-fisher-college/1100051/details/,"Rochester, NY","$34,340",68%,11:1,"St. John Fisher College is a coeducational liberal arts college located in Pittsford, New York. Its 154-acre campus is located in Rochester."
St. John's University,https://www.collegexpress.com/college/st-johns-university/1100054/details/,"Queens, NY","$43,160",75%,17:1,"St. John's University, founded in 1870, is a private, Roman Catholic university. Its 102-acre main campus is located in the Jamaica section of Queens in New York City."
St. Joseph's University—Brooklyn,https://www.collegexpress.com/college/st-josephs-university-brooklyn/1100060/details/,"Brooklyn, NY","$28,590",70%,10:1,"St. Joseph's University (formerly College) in Brooklyn is a private Catholic liberal arts institution. Founded as a women's college in 1916, it adopted coeducation in 1969. Its five-acre campus is located in a residential section of Brooklyn, 5 miles from Midtown Manhattan."
St. Joseph's University—Long Island,https://www.collegexpress.com/college/st-josephs-university-long-island/1100037/details/,"Patchogue, NY",,,13:1,"Founded in 1916, St. Joseph's University (formerly College) on Long Island is a private Catholic liberal arts institution. Its 56-acre campus is located in Patchoque, 55 miles from midtown Manhattan."
St. Lawrence University,https://www.collegexpress.com/college/st-lawrence-university/1100066/details/,"Canton, NY","$58,330",47%,11:1,"St. Lawrence University, founded in 1856, is a private, liberal arts university. Its 1,000-acre campus is located in Canton, in northern New York."
St. Thomas Aquinas College,https://www.collegexpress.com/college/st-thomas-aquinas-college/1100073/details/,"Sparkill, NY","$33,400",86%,16:1,"St. Thomas Aquinas College is a private, liberal arts college. Founded in 1952, it adopted coeducation in 1968. Its 43-acre campus is located in Sparkill, 15 miles from New York City."
Stony Brook University,https://www.collegexpress.com/college/stony-brook-university/1100134/details/,"Stony Brook, NY","$7,070",48%,18:1,"Stony Brook University, State University of New York, founded in 1957, is a public research university. Its 1,040-acre campus is located on the North Shore of Long Island, 60 miles east of New York City"
"Studio Jewelers, Ltd.",https://www.collegexpress.com/college/studio-jewelers-ltd/3303335/details/,"New York, NY",,,,"Studio Jewelers, Ltd. founded in 1979, is a jewelry trade school, located in New York."
Suffolk County Community College—Ammerman Campus,https://www.collegexpress.com/college/suffolk-county-community-college-ammerman-campus/3300999/details/,"Selden, NY","$5,470",,,"Suffolk County Community College is a public two-year institution with three campuses in Selden, Brentwood, and Riverhead, New York."
Suffolk County Community College—Eastern Campus,https://www.collegexpress.com/college/suffolk-county-community-college-eastern-campus/3303910/details/,"Riverhead, NY","$5,220",,,"Suffolk County Community College is a public two-year institution with three campuses in Riverhead,  Brentwood, and Selden, New York."
Suffolk County Community College—Grant Campus,https://www.collegexpress.com/college/suffolk-county-community-college-grant-campus/3303909/details/,"Brentwood, NY","$5,220",,,"Suffolk County Community College is a public two-year institution with three campuses in Brentwood, Riverhead, and Selden, New York."
SUNY Adirondack,https://www.collegexpress.com/college/suny-adirondack/3301630/details/,"Queensbury, NY","$4,944",,20:1,"Founded in 1961, SUNY Adirondack is a public community liberal arts college. Its campus is located in Queensbury, New York."
SUNY Brockport,https://www.collegexpress.com/college/suny-brockport/1100135/details/,"Brockport, NY","$7,070",58%,17:1,"SUNY Brockport, founded in 1835, is a public, comprehensive four-year college. Its 464-acre campus is located in Brockport, NY: 16 miles west of Rochester, NY, 45 miles east of Buffalo, NY, and a short drive from the Canadian border."
SUNY Broome Community College,https://www.collegexpress.com/college/suny-broome-community-college/3300955/details/,"Binghamton, NY","$5,088",,,"Broome Community College is a public, comprehensive community college supervised the the State University of New York, sponsored by the County of Broome, and governed by a Board of Trustees. Chartered in 1946 Broome Community College's 220-acre campus is located in BInghamton, New York."
SUNY Canton,https://www.collegexpress.com/college/suny-canton/5009129/details/,"Canton, NY","$7,070",83%,18:1,"Founded in 1906, SUNY Canton is a public coeducational residential college located on a 555-acre campus along the banks of the Grasse River in Canton, New York."
SUNY Cobleskill,https://www.collegexpress.com/college/suny-cobleskill/3000130/details/,"Cobleskill, NY","$7,070",80%,16:1,"Founded in 1911, SUNY Cobleskill is a public polytechnic college with a rich academic tradition spanning over 100 years. Over 2,300 students are enrolled in the 58 certificate, associate, and baccalaureate degree programs offered.  Its 902-acre campus is located in Cobleskill, 35 miles from Albany."
SUNY College of Environmental Science and Forestry,https://www.collegexpress.com/college/suny-college-of-environmental-science-and-forestry/1100142/details/,"Syracuse, NY","$7,070",60%,13:1,"SUNY College of Environmental Science and Forestry, founded in 1911, is a public, multipurpose college. Its 12-acre campus is located in Syracuse."
SUNY Corning Community College,https://www.collegexpress.com/college/suny-corning-community-college/3300983/details/,"Corning, NY","$5,068",,,"Corning Community College, founded in 1956, is a public, coeducational, two-year institution. Its campus is located in Corning, NY."
SUNY Cortland,https://www.collegexpress.com/college/suny-cortland/1100140/details/,"Cortland, NY","$7,070",52%,16:1,"SUNY Cortland, founded in 1868, is a public, multipurpose college of arts and sciences. Its 191-acre campus is located in Cortland, 30 miles from Syracuse."
SUNY Delhi,https://www.collegexpress.com/college/suny-delhi/3300952/details/,"Delhi, NY","$7,070",64%,15:1,"SUNY--Delhi, founded in 1913, is a public, coeducational institution offering degrees ranging from the Certificate to Master's level.  Its campus is located in Delhi, New York."
SUNY Empire State College,https://www.collegexpress.com/college/suny-empire-state-college/3000011/details/,"Saratoga Springs, NY","$7,070",,15:1,"SUNY Empire State College, founded in 1971, is a public, coeducational institution. Its campus is located in Saratoga Springs, New York."
SUNY Fredonia,https://www.collegexpress.com/college/suny-fredonia/1100143/details/,"Fredonia, NY","$7,070",72%,14:1,"State University of New York at Fredonia is a public comprehensive selective liberal arts university in western New York, just minutes from Lake Erie. Founded in 1826, the university is among the oldest in the SUNY system."
SUNY Geneseo,https://www.collegexpress.com/college/suny-geneseo/1100146/details/,"Geneseo, NY","$7,070",61%,17:1,"SUNY Geneseo, founded in 1871, is a public, multipurpose college of liberal arts and sciences. Its 220-acre campus is located in Geneseo, NY, 30 miles south of Rochester."
SUNY Maritime College,https://www.collegexpress.com/college/suny-maritime-college/1100167/details/,"Throggs Neck, NY","$7,070",72%,,"SUNY Maritime College, founded in 1874, is a public, multipurpose college for the maritime and related industries. Its 56-acre campus is located in Throggs Neck."
SUNY Morrisville,https://www.collegexpress.com/college/suny-morrisville/5009395/details/,"Morrisville, NY","$7,070",,,"SUNY Morrisville, founded in 1908, is a public, coeducational institution. Its campus is located in Morrisville, NY."
SUNY New Paltz,https://www.collegexpress.com/college/suny-new-paltz/1100148/details/,"New Paltz, NY","$7,070",62%,16:1,"Founded in 1828, SUNY New Paltz is a public multipurpose institution of arts and sciences. Its 216-acre campus is located in New Paltz, 75 miles from Albany."
SUNY Old Westbury,https://www.collegexpress.com/college/suny-old-westbury/1100149/details/,"Old Westbury, NY","$7,070",53%,18:1,"SUNY College at Old Westbury, founded in 1965, is a comprehensive public college offering undergraduate and graduate degrees. With a wooded 604-acre campus centrally located on Long Island, the nation's 17th largest population center, Old Westbury offers the best of both worlds -- a quiet atmosphere dedicated to learning, yet just 20 miles from the heart of New York City."
SUNY Oneonta,https://www.collegexpress.com/college/suny-oneonta/1100151/details/,"Oneonta, NY","$7,070",62%,17:1,"SUNY Oneonta, founded in 1889, is a public, multipurpose university of liberal arts and sciences. Its 250-acre campus is located in Oneonta, 75 miles southwest of Albany."
SUNY Oswego,https://www.collegexpress.com/college/suny-oswego/1100153/details/,"Oswego, NY","$7,070",68%,17:1,"SUNY Oswego, founded in 1861, is a public, multipurpose college of arts and sciences. Its 696-acre campus is located in Oswego, 35 miles northwest of Syracuse, on the shore of Lake Ontario."
SUNY Plattsburgh,https://www.collegexpress.com/college/suny-plattsburgh/1100155/details/,"Plattsburgh, NY","$7,070",61%,16:1,"SUNY Plattsburgh, founded in 1889, is a public, multipurpose college of arts and sciences. Its 300-acre campus is located in Plattsburgh, 60 miles from Montreal, Canada."
SUNY Polytechnic Institute,https://www.collegexpress.com/college/suny-polytechnic-institute/1100163/details/,"Utica and Albany, NY","$7,070",73%,13:1,"SUNY Polytechnic Institute, founded in 1966, is a public institute of technology. It has campuses in Utica and Albany, New York."
SUNY Potsdam,https://www.collegexpress.com/college/suny-potsdam/1100159/details/,"Potsdam, NY","$7,070",71%,11:1,"SUNY Potsdam, founded in 1816, is a public, liberal arts college. Its 240-acre campus is located in Potsdam NY, north of Syracuse."
SUNY Sullivan,https://www.collegexpress.com/college/suny-sullivan/3301000/details/,"Loch Sheldrake, NY","$5,208",,18:1,"Sullivan County Community College, founded in 1963, is a public two-year institution. Its 405-acre campus is located in Loch Sheldrake, NY."
SUNY Ulster,https://www.collegexpress.com/college/suny-ulster/3303908/details/,"Stone Ridge, NY","$4,880",,,"SUNY Ulster is a public two-year institution. Its campus is located in Stone Ridge, NY."
SUNY Upstate Medical University,https://www.collegexpress.com/college/suny-upstate-medical-university/1100169/details/,"Syracuse, NY",,,,"SUNY Upstate Medical University, founded in 1950, is a public, comprehensive institution. Its 30-acre campus is located in downtown Syracuse."
Syracuse University,https://www.collegexpress.com/college/syracuse-university/1100182/details/,"Syracuse, NY","$54,270",68%,,"Syracuse University, founded in 1870, is a private, coeducational institution. Its 708-acre campus is located in Syracuse.  The University's original colors were pink and pea green. Orange became the official color in 1890."
"The City College of New York, CUNY",https://www.collegexpress.com/college/the-city-college-of-new-york-cuny/2100313/details/,"New York, NY","$6,930",50%,10:1,"Founded in 1847 as the Free Academy, the City College of New York is a public institution and the first of City University of New York schools. Programs are offered through the College of Liberal Arts and Science and the Schools of Architecture, Education, and Engineering, and the Division of the Arts. Its 35-acre campus of Gothic and modern architecture is located in New York's St. Nicholas Heights section."
The College of Saint Rose,https://www.collegexpress.com/college/the-college-of-saint-rose/1100072/details/,"Albany, NY","$33,152",81%,14:1,"The College of Saint Rose, founded in 1920, is a private, independent, coeducational institution of higher education offering more than 100 bachelor's, master's, and certificate degree programs. The College serves undergraduate and graduate students, working professionals, international students, and more. Its 49-acre campus is located in Albany, New York."
"The College of Staten Island, CUNY",https://www.collegexpress.com/college/the-college-of-staten-island-cuny/2100312/details/,"Staten Island, NY","$6,930",,19:1,"Formed in 1976 through the merger of Staten Island Community College and Richmond College, The College of Staten Island is a public liberal arts college. Its 204-acre campus is located in Staten Island, a borough of New York City."
The College of Westchester,https://www.collegexpress.com/college/the-college-of-westchester/3101096/details/,"White Plains, NY","$21,060",88%,,"The College of Westchester, founded in 1915, is a coeducation, private college providing students with an education in diverse community and preparing them for professional careers. It's campus is located in White Plains, New York."
The Cooper Union for the Advancement of Science and Art,https://www.collegexpress.com/college/the-cooper-union-for-the-advancement-of-science-and-art/1100301/details/,"New York, NY","$44,550",17%,6:1,"The Cooper Union for the Advancement of Science and Art, founded in 1859, is a private, multipurpose institution located in lower Manhattan."
The Culinary Institute of America at Hyde Park,https://www.collegexpress.com/college/the-culinary-institute-of-america-at-hyde-park/3000320/details/,"Hyde Park, NY","$32,000",96%,18:1,"The Culinary Institute of America (CIA), founded in 1946, is an independent, non-profit, specialized college. Its 172-acre main campus is located in New York (Hyde Park)."
The King's College,https://www.collegexpress.com/college/the-kings-college/3000468/details/,"New York, NY","$37,000",39%,,"The King's College, founded in 1938 and reorganized in 1999, is a private Christian college. Its campus is located in New York."
The New School Center for Media,https://www.collegexpress.com/college/the-new-school-center-for-media/3101053/details/,"Albany, NY",,,,"The New School Center for Media (formerly The New School of Radio and Television), is a private, specialized institution. Its campus is located in Albany."
The New School College of Performing Arts,https://www.collegexpress.com/college/the-new-school-college-of-performing-arts/5003739/details/,"New York, NY","$48,760",49%,7:1,"The New School College of Performing Arts is a private coeducational institution that consists of three schools: the Mannes School of Music, the School of Drama, and the School of Jazz & Contemporary Music. Its campus is located in New York City."
The New School for Public Engagement,https://www.collegexpress.com/college/the-new-school-for-public-engagement/4000869/details/,"New York, NY","$31,742",,,"The New School for Public Engagement, founded in 1919, is a private, coeducational institution. Its campus is located in New York."
The New York Conservatory for Dramatic Arts School of Film and Television,https://www.collegexpress.com/college/the-new-york-conservatory-for-dramatic-arts-school-of-film-and-television/3303885/details/,"New York, NY","$33,900",95%,,"The New York Conservatory for Dramatic Arts is an institutionally accredited member of The National Association of Schools of Theatre (NAST), located in the heart of New York City."
The State University of New York Recruitment Response Center,https://www.collegexpress.com/college/the-state-university-of-new-york-recruitment-response-center/5006301/details/,"Albany, NY",,,,"The State University of New York, SUNY for short, university system is home to 64 colleges across the state of New York. It's university system administration building is located in Albany."
Tompkins Cortland Community College,https://www.collegexpress.com/college/tompkins-cortland-community-college/3300969/details/,"Dryden, NY","$5,355",,,"Founded in 1968, Tompkins Cortland Community College is a public two-year liberal arts institution. Its 220-acre campus is located in Dryden, NY."
Touro College,https://www.collegexpress.com/college/touro-college/1100199/details/,"New York, NY","$19,950",75%,13:1,"Touro College in New York, founded in 1971, is a private college part of the Touro College and University System, the largest not-for-profit independent institution of higher and professional education under Jewish auspices in the country. Its urban campus is located in downtown Manhattan."
Trocaire College,https://www.collegexpress.com/college/trocaire-college/3301636/details/,"Buffalo, NY","$17,980",53%,,"Trocaire College, founded in 1958, is a private, two-year, coeducational institution. Its campus is located in Buffalo, New York."
Union College,https://www.collegexpress.com/college/union-college/1100211/details/,"Schenectady, NY","$58,956",41%,10:1,"Union College, founded in 1795 and the first college chartered by the New York State Board of Regents, offers programs in the liberal arts and engineering. Union's curriculum emphasizes collaboration with students and faculty through small classes and undergraduate research, an international experience in all disciplines and learning through service to the campus and community.  Located in the city of Schenectady, Union's campus is three hours from New York City and Boston."
United States Merchant Marine Academy,https://www.collegexpress.com/college/united-states-merchant-marine-academy/1100218/details/,"Kings Point, NY",,24%,12:1,"The U.S. Merchant Marine Academy is a federal academy. Founded in 1943, it adopted coeducation in 1974. Its 80-acre campus is located in Kings Point, on the north shore of Long Island, 20 miles east of mid-town New York City."
United States Military Academy,https://www.collegexpress.com/college/united-states-military-academy/1100219/details/,"West Point, NY",,8%,7:1,"Founded in 1802, United States Military Academy is a fully funded four year college specifically charge with educating, training, and inspiring young men and women for service as commissioned officers in the US Army.  West Point is a picturesque 16,080-acre campus along the Hudson River in Orange County, New York."
University at Albany,https://www.collegexpress.com/college/university-at-albany/1100128/details/,"Albany, NY","$7,070",57%,18:1,"Founded in 1844, University at Albany is a public comprehensive research institution in the Capital Region of New York. Its 560-acre Uptown Campus is located in Albany."
University at Buffalo,https://www.collegexpress.com/college/university-at-buffalo/1100132/details/,"Buffalo, NY","$7,070",66%,15:1,"SUNY University at Buffalo, founded in 1846, is a public, coeducational institution. Its 1,350-acre campus is located in Buffalo, New York."
University of Rochester,https://www.collegexpress.com/college/university-of-rochester/1100166/details/,"Rochester, NY","$57,188",35%,,"The University of Rochester, founded in 1850, is a private, coeducational research university. Its 655-acre campus is located in Rochester, NY."
Utica College,https://www.collegexpress.com/college/utica-college/1100228/details/,"Utica, NY","$21,560",86%,11:1,"Utica College, founded in 1946, is a comprehensive, independent, private institution. Its 128-acre campus is located in Utica, 50 miles from Syracuse."
Vassar College,https://www.collegexpress.com/college/vassar-college/1100230/details/,"Poughkeepsie, NY","$60,030",24%,8:1,"Vassar College is a private, liberal arts college. Founded for women in 1861, it adopted coeducation in 1969. Its 1,000-acre campus is located on the outskirts of Poughkeepsie, 75 miles north of New York City. It includes a range of architecture from Gothic to modernist."
Vaughn College of Aeronautics and Technology,https://www.collegexpress.com/college/vaughn-college-of-aeronautics-and-technology/3000061/details/,"Flushing, NY","$25,300",,16:1,"Vaughn College of Aeronautics and Technology, founded in 1932, is a private, coeducational, four-year, specialized institution. Its campus is located in Flushing, New York."
Villa Maria College,https://www.collegexpress.com/college/villa-maria-college/3301637/details/,"Buffalo, NY","$24,000",78%,8:1,"Villa Maria College is a private, co-educational institution of higher education offering both associate and bachelor's degrees, emphasizing programs in the applied arts and music while offering and maintaining quality programs in other educational disciplines.  The college was established in 1961 and is located in the town of Cheektowaga, which borders the eastern edge of the city of Buffalo, NY."
Wagner College,https://www.collegexpress.com/college/wagner-college/1100246/details/,"Staten Island, NY","$48,010",70%,12:1,"Founded in 1883, Wagner College is a four-year liberal arts college. Its 110-acre campus is located on Staten Island."
Webb Institute,https://www.collegexpress.com/college/webb-institute/1100251/details/,"Glen Cove, NY","$52,420",21%,9:1,"Webb Institute is a private institute of naval architecture and marine engineering. Founded in 1889, it adopted coeducation in 1974. Its 26-acre campus is located in Glen Cove, on the north shore of Long Island, 22 miles from New York City."
Wells College,https://www.collegexpress.com/college/wells-college/1100258/details/,"Aurora, NY","$30,300",64%,9:1,"Wells College, founded in 1868, is a private, coeducational, liberal arts college. Its 365-acre campus is located in Aurora, New York on the eastern shore of stunning Cayuga Lake."
Westchester Community College,https://www.collegexpress.com/college/westchester-community-college/3301002/details/,"Valhalla, NY","$4,580",,,"Westchester Community College, founded in 1946 is a public two year college. Its 218-acre campus is located in Valhalla, Westchester County in New York State."
Wilson Technological Center,https://www.collegexpress.com/college/wilson-technological-center/3302613/details/,"Dix Hills, NY",,,,"Wilson Technological Center, a division of Western Suffolk BOCES, is a public, coeducational, technical/professional institution. Its campus is located in Dix Hills, New York."
Yeshiva University,https://www.collegexpress.com/college/yeshiva-university/1100308/details/,"New York, NY","$43,575",67%,7:1,"Yeshiva University, founded in 1886, is a private, comprehensive university. Its facilities are located at three centers in Manhattan and one in the Bronx."
"York College, CUNY",https://www.collegexpress.com/college/york-college-cuny/1100520/details/,"Jamaica, NY","$6,930",52%,18:1,"Founded in 1966, York College is a public institution offering liberal arts and career education and is a member of the City University of New York school system. Its 50-acre campus is located in Jamaica."
