Name,Location,Website,Tuition,Acceptance Rate,Student-Faculty Ratio,Description,School Type,Largest Program
AMDA New York,"New York, NY",https://www.collegexpress.com/college/amda-new-york/3302606/details/,"$41,660",44%,Information Unavailable,"The American Musical and Dramatic Academy, founded in 1964, is a private two-year institution. Its campus is located in New York, NY.",Information Unavailable,Information Unavailable
AMG School of Nursing,"110 Bridge Street, Brooklyn, New York 11201-1728",amg.edu/,Information Unavailable,Information Unavailable,Information Unavailable,Information Unavailable,"2-year, Private for-profit",Licensed Practical/Vocational Nurse Training
ASA College,"Brooklyn, NY",https://www.collegexpress.com/college/asa-college/3100996/details/,"$11,880",Information Unavailable,Information Unavailable,"ASA College is a private, coeducational institution. Its campus is located in Brooklyn, NY.",Information Unavailable,Information Unavailable
Access Careers,"474 Fulton Avenue, Suite 201, Hempstead, New York 11550-0000",www.accesscareers.net/,Information Unavailable,Information Unavailable,Information Unavailable,Information Unavailable,"< 2-year, Private for-profit","Practical Nursing, Vocational Nursing and Nursing Assistants, Other"
Access Careers-Islandia,"1930 Veterans Highway, Suite 10, Islandia, New York 11749-1599",www.accesscareers.net/,Information Unavailable,Information Unavailable,Information Unavailable,Information Unavailable,"< 2-year, Private for-profit","Practical Nursing, Vocational Nursing and Nursing Assistants, Other"
Ace Institute of Technology,"312 West 36 Street, 2nd Floor, New York, New York 10018",www.acecareer.edu/,Information Unavailable,Information Unavailable,Information Unavailable,Information Unavailable,"2-year, Private for-profit",Medical/Clinical Assistant
Adelphi University,"Garden City, NY",https://www.collegexpress.com/college/adelphi-university/1100006/details/,"$39,820",74%,12:1,"Adelphi University, founded in 1896, is a private, coeducational institution. It is known for being a dotoral research university, with focus on the 'Core Four' areas of learning: arts and humanities; STEM and social sciences; business and education professions; and health and wellness. Its main 75-acre campus is in Garden City on Long Island, just 23 miles from New York City.","4-year, Private not-for-profit",-
Aesthetic Science Institute,"922 Troy-Schenectady Road, Latham, New York 12110-1095",www.aestheticscienceinstitute.edu/,Information Unavailable,Information Unavailable,Information Unavailable,Information Unavailable,"< 2-year, Private for-profit",Aesthetician/Esthetician and Skin Care Specialist
Albany BOCES-Adult Practical Nursing Program,"900  Watervliet Shaker Rd, Albany, New York 12205",https://www.capitalregionboces.org/adult-education/classes-programs/,Information Unavailable,Information Unavailable,Information Unavailable,Information Unavailable,"< 2-year, Public",Licensed Practical/Vocational Nurse Training
Albany College of Pharmacy and Health Sciences,"Albany, NY",https://www.collegexpress.com/college/albany-college-of-pharmacy-and-health-sciences/1100007/details/,"$36,120",75%,8:1,"Established in 1881, Albany College of Pharmacy and Health Sciences is a private independent specialized health care institution with campuses in Albany, New York, and Colchester, Vermont.","4-year, Private not-for-profit",-
Albany Law School,"80 New Scotland Avenue, Albany, New York 12208",www.albanylaw.edu/,Information Unavailable,Information Unavailable,Information Unavailable,Information Unavailable,"4-year, Private not-for-profit",-
Albany Medical College,"47 New Scotland Ave, Albany, New York 12208-3479",www.amc.edu/,Information Unavailable,Information Unavailable,Information Unavailable,Information Unavailable,"4-year, Private not-for-profit",-
Albert Einstein College of Medicine,"1300 Morris Park Avenue, Bronx, New York 10461-1900",www.einsteinmed.edu/,Information Unavailable,Information Unavailable,Information Unavailable,Information Unavailable,"4-year, Private not-for-profit",-
Alfred State College,"Alfred, NY",https://www.collegexpress.com/college/alfred-state-college/3000097/details/,"$7,070",71%,18:1,"SUNY College of Technology at Alfred, or Alfred State College, was founded as a school of agriculture in 1908, and was incorporated into the SUNY system in 1948. Today, the college offers a wide variety of majors, from welding to buisness, and focuses on hands-on instruction. Its 150-acre campus is located in Alfred, 75 miles south of Rochester, with a branch campus in Wellsville.",Information Unavailable,Information Unavailable
Alfred University,"Alfred, NY",https://www.collegexpress.com/college/alfred-university/1100014/details/,"$33,760",64%,11:1,"Alfred University is a private, coeducational institution. Its 600-acre campus is located in Alfred, 75 miles south of Rochester.","4-year, Private not-for-profit",-
Allen School-Brooklyn,"188 Montague Street, Brooklyn, New York 11201",www.allenschool.edu/,Information Unavailable,Information Unavailable,Information Unavailable,Information Unavailable,"< 2-year, Private for-profit",Medical/Clinical Assistant
Allen School-Jamaica,"163-18 Jamaica Avenue, Jamaica, New York 11432",www.allenschool.edu/,Information Unavailable,Information Unavailable,Information Unavailable,Information Unavailable,"< 2-year, Private for-profit",Medical/Clinical Assistant
Alliance Computing Solutions,"3660 Main Street, 4th Floor, Flushing, New York 11354-6507",www.acs.edu/,Information Unavailable,Information Unavailable,Information Unavailable,Information Unavailable,"< 2-year, Private for-profit",Medical/Clinical Assistant
Alliance Computing Solutions - NYC,"545 8th Avenue Suite 1210, New York, New York 10018-4313",www.acs.edu/,Information Unavailable,Information Unavailable,Information Unavailable,Information Unavailable,"< 2-year, Private for-profit",Medical/Clinical Assistant
Alliance University,"New York, NY",https://www.collegexpress.com/college/alliance-university/2800143/details/,"$25,000",97%,12:1,"Alliance University, founded in 1882, is a private, Christian liberal arts college located in lower Manhattan.",Information Unavailable,Information Unavailable
American Academy McAllister Institute of Funeral Service,"1501 Broadway, 11th Floor, Suite 1102, New York, New York 10036",www.funeraleducation.org/,Information Unavailable,Information Unavailable,Information Unavailable,Information Unavailable,"2-year, Private not-for-profit",-
American Academy of Dramatic Arts,"New York, NY",https://www.collegexpress.com/college/american-academy-of-dramatic-arts/3301905/details/,"$36,480",57%,Information Unavailable,"American Academy of Dramatic Arts, founded in 1884, is a private specialized two-year institution. Its campus is located in New York, NY with a branch campus in Los Angeles.",Information Unavailable,Information Unavailable
American Academy of Dramatic Arts-New York,"120 Madison Ave, New York, New York 10016",www.aada.edu/,Information Unavailable,Information Unavailable,Information Unavailable,Information Unavailable,"2-year, Private not-for-profit",-
American Beauty School,"1380 Metropolitan Avenue, Bronx, New York 10462",www.americanbeautyschool.edu/,Information Unavailable,Information Unavailable,Information Unavailable,Information Unavailable,"< 2-year, Private for-profit","Cosmetology/Cosmetologist, General"
American Musical and Dramatic Academy,"211 West 61st Street, New York, New York 10023",www.amda.edu/,Information Unavailable,Information Unavailable,Information Unavailable,Information Unavailable,"4-year, primarily associate's, Private not-for-profit",-
Apex Technical School,"Long Island City, NY",https://www.collegexpress.com/college/apex-technical-school/3101001/details/,Information Unavailable,Information Unavailable,13:1,"Apex Technical School prepares students for career opportunities utilizing hands on technical training. The school has a rich tradition of service to New Yorkers since 1961 as a private school, licensed by the State of New York Education Department and accredited by the Accrediting Commission of Career Schools and Colleges.","< 2-year, Private for-profit",Electrician
Arnot Ogden Medical Center,"600 Roe Avenue, Elmira, New York 14905-1676",www.arnothealth.org/,Information Unavailable,Information Unavailable,Information Unavailable,Information Unavailable,"2-year, Private not-for-profit",Registered Nursing/Registered Nurse
Arrojo Cosmetology School,"56 King St., New York, New York 10014",www.arrojocosmetology.com/,Information Unavailable,Information Unavailable,Information Unavailable,Information Unavailable,"< 2-year, Private for-profit","Cosmetology/Cosmetologist, General"
Associated Beth Rivkah Schools,"310 Crown Street, Brooklyn, New York 11225-0000",https://www.bethrivkah.edu/dhl,Information Unavailable,Information Unavailable,Information Unavailable,Information Unavailable,"4-year, primarily associate's, Private not-for-profit",-
Atelier Esthetique Institute of Esthetics,"226 East 26th Street 7th Floor, New York, New York 10001",www.aeinstitute.net/,Information Unavailable,Information Unavailable,Information Unavailable,Information Unavailable,"< 2-year, Private for-profit",Aesthetician/Esthetician and Skin Care Specialist
Atlantic Acting School,"New York, NY",https://www.collegexpress.com/college/atlantic-acting-school/5001345/details/,"$17,000",Information Unavailable,Information Unavailable,Atlantic Acting School is a specialized institution. Its campus is located in New York.,Information Unavailable,Information Unavailable
Austin Medical Assistant Training,"109-15 72nd Road, Unit 1A, Forest Hills, New York 11375-0000",https://amat.edu/,Information Unavailable,Information Unavailable,Information Unavailable,Information Unavailable,"2-year, Private for-profit",Medical Office Assistant/Specialist
Aveda Arts & Sciences Institute-New York,"233 Spring St, New York, New York 10013",avedaarts.edu/,Information Unavailable,Information Unavailable,Information Unavailable,Information Unavailable,"< 2-year, Private for-profit","Cosmetology/Cosmetologist, General"
Bais Binyomin Academy,"51 Carlton Road, Monsey, New York 10952",https://baisbinyominacademy.com/,Information Unavailable,Information Unavailable,Information Unavailable,Information Unavailable,"4-year, primarily associate's, Private not-for-profit",-
Bais Medrash Elyon,"73 Main Street, Monsey, New York 10952",baismedroshelyon.com/,Information Unavailable,Information Unavailable,Information Unavailable,Information Unavailable,"4-year, Private not-for-profit",-
Bais Medrash of Dexter Park,"445 South Pascack Road, Chestnut Ridge, New York 10977",https://bmdpark.com/,Information Unavailable,Information Unavailable,Information Unavailable,Information Unavailable,"4-year, primarily associate's, Private not-for-profit",-
Bank Street College of Education,"610 W 112 St, New York, New York 10025",www.bankstreet.edu/,Information Unavailable,Information Unavailable,Information Unavailable,Information Unavailable,"4-year, Private not-for-profit",-
Barber & Beauty Institute of New York,"266 Greenwich Street, Hempstead, New York 11550-6317",www.bbiny.edu/#,Information Unavailable,Information Unavailable,Information Unavailable,Information Unavailable,"< 2-year, Private for-profit",Barbering/Barber
Bard College,"Annandale-on-Hudson, NY",https://www.collegexpress.com/college/bard-college/1100165/details/,"$55,566",56%,10:1,"Bard College, founded in 1860, is a private, liberal arts college. Its 1,000-acre campus is located in Annandale-on-Hudson, 90 miles north of New York City.","4-year, Private not-for-profit",-
Bard College - Albion Correctional Facility,"3595 State School Road, Albion, New York 14411-9399",https://www.bard.edu/,Information Unavailable,Information Unavailable,Information Unavailable,Information Unavailable,"4-year, Private not-for-profit",-
Bard College - Bard Globalization and International Affairs Program,"108 West 39th Street Suite 1000A, New York, New York 10018-3614",https://www.bard.edu/,Information Unavailable,Information Unavailable,Information Unavailable,Information Unavailable,"4-year, Private not-for-profit",-
Bard College - Brooklyn Public Library,"10 Grand Army Plaza, Brooklyn, New York 11238-5619",https://www.bard.edu/,Information Unavailable,Information Unavailable,Information Unavailable,Information Unavailable,"2-year, Private not-for-profit",-
Bard College - Coxsackie Correctional Facility,"11260 Route 9W, Coxsackie, New York 12051-0200",https://www.bard.edu/,Information Unavailable,Information Unavailable,Information Unavailable,Information Unavailable,"< 2-year, Private not-for-profit",-
Bard College - Eastern NY Correctional Facility,"30 Institution Road, Napanoch, New York 12458-0338",https://www.bard.edu/,Information Unavailable,Information Unavailable,Information Unavailable,Information Unavailable,"4-year, Private not-for-profit",-
Bard College - Fishkill Correctional Facility,"18 Strack Drive, Beacon, New York 12508-0307",https://www.bard.edu/,Information Unavailable,Information Unavailable,Information Unavailable,Information Unavailable,"4-year, Private not-for-profit",-
Bard College - Green Haven Correctional Facility,"594 Route 216, Stormville, New York 12582-0010",https://www.bard.edu/,Information Unavailable,Information Unavailable,Information Unavailable,Information Unavailable,"4-year, Private not-for-profit",-
"Bard College - New York Public Library, Countee Cullen Branch","104 West 136th Street New York Public Library, New York, New York 10030-2601",https://www.bard.edu/,Information Unavailable,Information Unavailable,Information Unavailable,Information Unavailable,"2-year, Private not-for-profit",-
Bard College - Taconic Correctional Facility,"250 Harris Road, Bedford Hill, New York 10507-2497",https://www.bard.edu/,Information Unavailable,Information Unavailable,Information Unavailable,Information Unavailable,"4-year, Private not-for-profit",-
Bard College - Woodbourne Correctional Facility,"99 Prison Road, Woodbourne, New York 12788-1000",https://www.bard.edu/,Information Unavailable,Information Unavailable,Information Unavailable,Information Unavailable,"4-year, Private not-for-profit",-
Barnard College,"New York, NY",https://www.collegexpress.com/college/barnard-college/1100168/details/,"$55,781",13%,9:1,"Barnard College, founded in 1889, is a private, liberal arts college for women affiliated with Columbia University. Its four-acre campus is located in the Upper West Side of Manhattan.","4-year, Private not-for-profit",-
"Baruch College, CUNY","New York, NY",https://www.collegexpress.com/college/baruch-college-cuny/1100930/details/,"$6,930",40%,19:1,"Founded in 1847, Bernard M. Baruch College of the City University of New York traces it roots to Free Academy. It is a public college located in the center of New York City's central business district.",Information Unavailable,Information Unavailable
Be'er Yaakov Talmudic Seminary,"12 Truman Avenue, Spring Valley, New York 10977",www.byts.edu/,Information Unavailable,Information Unavailable,Information Unavailable,Information Unavailable,"4-year, Private not-for-profit",-
Beis Medrash Heichal Dovid,"211 Beach Seventeenth Street, Far Rockaway, New York 11691-4433",www.heichaldovid.org/,Information Unavailable,Information Unavailable,Information Unavailable,Information Unavailable,"4-year, Private not-for-profit",-
Belanger School of Nursing,"650 McClellan St, Schenectady, New York 12304",www.ellismedicine.org/school-of-nursing/,Information Unavailable,Information Unavailable,Information Unavailable,Information Unavailable,"2-year, Private not-for-profit",-
Berk Trade and Business School,"Long Island City, NY",https://www.collegexpress.com/college/berk-trade-and-business-school/3101002/details/,Information Unavailable,Information Unavailable,20:1,"Berk Trade and Business School, founded in 1940, is a private, coeducational, technical/professional school. Its campus is located in Long Island City, New York.","< 2-year, Private for-profit","Electrical and Power Transmission Installation/Installer, General"
Berkeley College-New York,"3 East 43 Street, New York, New York 10017",https://berkeleycollege.edu/,Information Unavailable,Information Unavailable,Information Unavailable,Information Unavailable,"4-year, Private for-profit",-
Berkeley College—New York,"New York, NY",https://www.collegexpress.com/college/berkeley-college-new-york/3000461/details/,"$25,300",Information Unavailable,21:1,"Founded 1931, Berkeley College is a private coed institution. The main campus is located in mid-town Manhattan with additional locations in Brooklyn and White Plains, New York.  Programs also are available online.",Information Unavailable,Information Unavailable
Berkowits School of Electrolysis,"107-25 Metropolitan Avenue, Forest Hills, New York 11375-6820",estheticsschoolny.com/,Information Unavailable,Information Unavailable,Information Unavailable,Information Unavailable,"< 2-year, Private for-profit",Electrolysis/Electrology and Electrolysis Technician
Bet Medrash Gadol Ateret Torah,"1750 East Fourth Street, Brooklyn, New York 11223-1933",betmedrashgadolaterettorah.com/,Information Unavailable,Information Unavailable,Information Unavailable,Information Unavailable,"4-year, Private not-for-profit",-
Beth Hamedrash Shaarei Yosher Institute,"4102 16th Ave, Brooklyn, New York 11204",bhsy.edu/,Information Unavailable,Information Unavailable,Information Unavailable,Information Unavailable,"4-year, primarily associate's, Private not-for-profit",-
Beth Medrash Meor Yitzchok,"85 Dykstras Way East, Monsey, New York 10952-4023",https://bethmedrashmeoryitzchok.com/,Information Unavailable,Information Unavailable,Information Unavailable,Information Unavailable,"4-year, primarily associate's, Private not-for-profit",-
Binghamton University,"Binghamton, NY",https://www.collegexpress.com/college/binghamton-university/1100131/details/,"$7,070",43%,19:1,"Binghamton University, founded in 1946, is a medium-sized, comprehensive, doctoral-granting university. Its 930-acre campus is located in Binghamton, NY, just three hours from New York City and Philadelphia, PA.","4-year, Public",-
Bnos Zion Of Bobov Seminary,"5000 14th Avenue, Brooklyn, New York 11219-3621",https://www.bnoszionbobov.com/,Information Unavailable,Information Unavailable,Information Unavailable,Information Unavailable,"2-year, Private not-for-profit",-
Boricua College,"New York, NY",https://www.collegexpress.com/college/boricua-college/1100192/details/,"$11,000",Information Unavailable,Information Unavailable,"Boricua College, founded in 1974, is a private, liberal arts college with an English/Spanish bilingual and bicultural curriculum. Its campus is located in Manhattan.","4-year, Private not-for-profit",-
Borough of Manhattan Community College,"New York, NY",https://www.collegexpress.com/college/borough-of-manhattan-community-college/3300972/details/,"$4,800",Information Unavailable,24:1,"Borough of Manhattan Community College, founded in 1963, is a public two-year institution. Its campus is located in New York, NY.",Information Unavailable,Information Unavailable
Brittany Beauty Academy,"210 East 188th St, Bronx, New York 10458",https://brittanyacademy.edu/,Information Unavailable,Information Unavailable,Information Unavailable,Information Unavailable,"< 2-year, Private for-profit",Aesthetician/Esthetician and Skin Care Specialist
Brittany Beauty Academy,"375 86th Street, Brooklyn, New York 11209",brittanyacademy.edu/,Information Unavailable,Information Unavailable,Information Unavailable,Information Unavailable,"< 2-year, Private for-profit",Aesthetician/Esthetician and Skin Care Specialist
Brittany Beauty Academy,"3274 Hempstead Turnpike, Levittown, New York 11756-1345",https://brittanyacademy.edu/,Information Unavailable,Information Unavailable,Information Unavailable,Information Unavailable,"< 2-year, Private for-profit","Cosmetology/Cosmetologist, General"
Bronx Community College,"Bronx, NY",https://www.collegexpress.com/college/bronx-community-college/3300973/details/,"$4,800",Information Unavailable,Information Unavailable,"Bronx Community College is a public, coeducational, two-year institution. Its campus is located in the Bronx, NY.",Information Unavailable,Information Unavailable
"Brooklyn College, CUNY","Brooklyn, NY",https://www.collegexpress.com/college/brooklyn-college-cuny/1100518/details/,"$6,930",49%,Information Unavailable,"Founded in 1930, Brooklyn College is a public liberal arts institution in the City University of New York school system. Its 26-acre campus is located in Brooklyn's Flatbush section.",Information Unavailable,Information Unavailable
Brooklyn Law School,"250 Joralemon St, Brooklyn, New York 11201",www.brooklaw.edu/,Information Unavailable,Information Unavailable,Information Unavailable,Information Unavailable,"4-year, Private not-for-profit",-
Broome Delaware Tioga BOCES-Practical Nursing Program,"1100 East Main Street, Endicott, New York 13760",www.btboces.org/,Information Unavailable,Information Unavailable,Information Unavailable,Information Unavailable,"< 2-year, Public",Licensed Practical/Vocational Nurse Training
Bryant & Stratton College-Albany,"1259 Central Ave, Albany, New York 12205",https://www.bryantstratton.edu/,Information Unavailable,Information Unavailable,Information Unavailable,Information Unavailable,"4-year, primarily associate's, Private not-for-profit",-
Bryant & Stratton College-Amherst,"3650 Millersport Highway, Getzville, New York 14068",https://www.bryantstratton.edu/,Information Unavailable,Information Unavailable,Information Unavailable,Information Unavailable,"4-year, Private not-for-profit",-
Bryant & Stratton College-Buffalo,"110 Broadway, 2nd Floor, Buffalo, New York 14203",https://www.bryantstratton.edu/,Information Unavailable,Information Unavailable,Information Unavailable,Information Unavailable,"4-year, primarily associate's, Private not-for-profit",-
Bryant & Stratton College-Greece,"854 Long Pond Road, Rochester, New York 14612",https://www.bryantstratton.edu/,Information Unavailable,Information Unavailable,Information Unavailable,Information Unavailable,"4-year, primarily associate's, Private not-for-profit",-
Bryant & Stratton College-Henrietta,"1225 Jefferson Rd, Rochester, New York 14623",https://www.bryantstratton.edu/,Information Unavailable,Information Unavailable,Information Unavailable,Information Unavailable,"4-year, Private not-for-profit",-
Bryant & Stratton College-Online,"200 Redtail Rd, Orchard Park, New York 14127",https://www.bryantstratton.edu/,Information Unavailable,Information Unavailable,Information Unavailable,Information Unavailable,"4-year, primarily associate's, Private not-for-profit",-
Bryant & Stratton College-Southtowns,"Sterling Park - 180 Redtail Rd., Orchard Park, New York 14127",https://www.bryantstratton.edu/,Information Unavailable,Information Unavailable,Information Unavailable,Information Unavailable,"4-year, Private not-for-profit",-
Bryant & Stratton College-Syracuse,"953 James St, Syracuse, New York 13203-2502",https://www.bryantstratton.edu/,Information Unavailable,Information Unavailable,Information Unavailable,Information Unavailable,"2-year, Private not-for-profit",-
Bryant & Stratton College-Syracuse North,"7805 Oswego Rd, Liverpool, New York 13090",https://www.bryantstratton.edu/,Information Unavailable,Information Unavailable,Information Unavailable,Information Unavailable,"4-year, primarily associate's, Private not-for-profit",-
Buffalo State College,"Buffalo, NY",https://www.collegexpress.com/college/buffalo-state-college/1100138/details/,"$7,070",80%,15:1,"Buffalo State, SUNY College at Buffalo, founded in 1867, is a public, multipurpose college of arts and sciences. Its 115-acre, urban campus is located in Buffalo.",Information Unavailable,Information Unavailable
CUNY Bernard M Baruch College,"One Bernard Baruch Way (55 Lexington Ave at 24th St), New York, New York 10010",www.baruch.cuny.edu/,Information Unavailable,Information Unavailable,Information Unavailable,Information Unavailable,"4-year, Public",-
CUNY Borough of Manhattan Community College,"199 Chambers St, New York, New York 10007",www.bmcc.cuny.edu/,Information Unavailable,Information Unavailable,Information Unavailable,Information Unavailable,"2-year, Public",-
CUNY Bronx Community College,"2155 University Avenue, Bronx, New York 10453",www.bcc.cuny.edu/,Information Unavailable,Information Unavailable,Information Unavailable,Information Unavailable,"2-year, Public",-
CUNY Brooklyn College,"2900 Bedford Ave, Brooklyn, New York 11210",www.brooklyn.cuny.edu/,Information Unavailable,Information Unavailable,Information Unavailable,Information Unavailable,"4-year, Public",-
CUNY Brooklyn College - Feirstein Graduate School of Cinema,"25 Washington Avenue, Brooklyn, New York 11205-1202",www.brooklyn.edu/feirstein/,Information Unavailable,Information Unavailable,Information Unavailable,Information Unavailable,"4-year, Public",-
CUNY City College,"160 Convent Ave, New York, New York 10031",www.ccny.cuny.edu/,Information Unavailable,Information Unavailable,Information Unavailable,Information Unavailable,"4-year, Public",-
CUNY Graduate School and University Center,"365 Fifth Ave, New York, New York 10016",www.gc.cuny.edu/,Information Unavailable,Information Unavailable,Information Unavailable,Information Unavailable,"4-year, Public",-
CUNY Hostos Community College,"500 Grand Concourse, Bronx, New York 10451",www.hostos.cuny.edu/,Information Unavailable,Information Unavailable,Information Unavailable,Information Unavailable,"2-year, Public",-
CUNY Hunter College,"695 Park Ave, New York, New York 10065",www.hunter.cuny.edu/,Information Unavailable,Information Unavailable,Information Unavailable,Information Unavailable,"4-year, Public",-
