Name,Location,Website,Tuition,Acceptance Rate,Student-Faculty Ratio,Description,School Type,Largest Program
Ohr Hameir Theological Seminary,"141 Furnace Woods Rd, Peekskill, New York 10566",https://ohrhameir.com/,Information Unavailable,Information Unavailable,Information Unavailable,Information Unavailable,"4-year, primarily associate's, Private not-for-profit",-
Onondaga Community College,"Syracuse, NY",https://www.collegexpress.com/college/onondaga-community-college/3300965/details/,"$5,090",Information Unavailable,Information Unavailable,"Onondaga Community College, founded in 1962, is a public college. Its 230-acre campus is located in Syracuse.","2-year, Public",-
Onondaga Cortland Madison BOCES,"Main Campus, Liverpool, New York 13088",ocmboces.org/,Information Unavailable,Information Unavailable,Information Unavailable,Information Unavailable,"< 2-year, Public",Licensed Practical/Vocational Nurse Training
Orange County Community College,"Middletown, NY",https://www.collegexpress.com/college/orange-county-community-college/3300996/details/,"$5,376",Information Unavailable,Information Unavailable,"Orange County Community College, founded in 1950, is a public, two-year, liberal arts institution. Its 37-acre campus is located in Middletown, NY.","2-year, Public",-
Orange Ulster BOCES-Practical Nursing Program,"3 Washington Center, Newburgh, New York 12550",www.ouboces.org/,Information Unavailable,Information Unavailable,Information Unavailable,Information Unavailable,"< 2-year, Public",Licensed Practical/Vocational Nurse Training
Orleans Niagara BOCES-Practical Nursing Program,"50 Main Street, Lockport, New York 14094",https://www.onboces.org/,Information Unavailable,Information Unavailable,Information Unavailable,Information Unavailable,"< 2-year, Public",Licensed Practical/Vocational Nurse Training
Orlo School of Hair Design and Cosmetology,"232 North Allen St, Albany, New York 12206",www.theorloschool.com/,Information Unavailable,Information Unavailable,Information Unavailable,Information Unavailable,"< 2-year, Private for-profit","Cosmetology/Cosmetologist, General"
Otsego Area BOCES-Practical Nursing Program,"31 Center Street 3rd floor, Oneonta, New York 13820-1142",www.oncboces.org/,Information Unavailable,Information Unavailable,Information Unavailable,Information Unavailable,"< 2-year, Public",Licensed Practical/Vocational Nurse Training
Pace University,"New York, NY",https://www.collegexpress.com/college/pace-university/1100090/details/,"$49,550",82%,14:1,"Pace University, founded in 1906, is a private, comprehensive university. Its three-acre urban campus is located in New York City and its 200-acre suburban campus is located in Pleasantville-Briarcliff, 20 miles from New York City.","4-year, Private not-for-profit",-
Pace University—Westchester,"Pleasantville, NY",https://www.collegexpress.com/college/pace-university-westchester/200000054/details/,"$49,550",85%,14:1,"Founded in 1906, Pace University is a private comprehensive university. Its three-acre urban campus is located in New York City and its 200-acre suburban campus is located in Pleasantville-Briarcliff, 20 miles from New York City.",Information Unavailable,Information Unavailable
Pacific College of Health and Science,"110 William St. 19th Fl, New York, New York 10038",www.pacificcollege.edu/,Information Unavailable,Information Unavailable,Information Unavailable,Information Unavailable,"4-year, Private for-profit",-
Parsons School of Design at The New School,"New York, NY",https://www.collegexpress.com/college/parsons-school-of-design-at-the-new-school/1100100/details/,"$50,460",46%,10:1,"Founded in 1896 and affiliated with The New School in 1970, Parsons School of Design is a private coeducational school of the arts. Its campus is located in New York City.",Information Unavailable,Information Unavailable
Paul Mitchell the School-NYC,"187 New Dorp Lane, Staten Island, New York 10306",paulmitchell.edu/nyc,Information Unavailable,Information Unavailable,Information Unavailable,Information Unavailable,"< 2-year, Private for-profit","Cosmetology/Cosmetologist, General"
Paul Mitchell the School-Schenectady,"411 State Street, Schenectady, New York 12305-2303",paulmitchell.edu/schenectady,Information Unavailable,Information Unavailable,Information Unavailable,Information Unavailable,"< 2-year, Private for-profit","Cosmetology/Cosmetologist, General"
Paul Smith's College,"Paul Smiths, NY",https://www.collegexpress.com/college/paul-smiths-college/3000445/details/,"$30,160",67%,12:1,"Paul Smith's College, founded in 1937, is a private, specialized institution. Its 14,200-acre wilderness campus is located in Paul Smith's, New York.",Information Unavailable,Information Unavailable
Paul Smiths College of Arts and Science,"7777 State Route 30, Paul Smiths, New York 12970-0265",https://www.paulsmiths.edu/,Information Unavailable,Information Unavailable,Information Unavailable,Information Unavailable,"4-year, Private not-for-profit",-
Plaza College,"Forest Hills, NY",https://www.collegexpress.com/college/plaza-college/3101065/details/,"$12,000",30%,28:1,"Plaza College, founded in 1916, is a private two-year institution. Its campus is located in Forest Hills, NY.","4-year, primarily associate's, Private for-profit",-
Pomeroy College of Nursing at Crouse Hospital,"5000 Brittonfield Parkway, East Syracuse, New York 13057-1687",www.crouse.org/nursing,Information Unavailable,Information Unavailable,Information Unavailable,Information Unavailable,"2-year, Private not-for-profit",-
Pratt Institute,"Brooklyn, NY",https://www.collegexpress.com/college/pratt-institute/1100158/details/,"$51,754",65%,9:1,"Pratt Institute, founded in 1887, is a private, multipurpose institute. Programs are offered through the Schools of Architecture and Art and Design. Its 25-acre campus is located in Brooklyn.",Information Unavailable,Information Unavailable
Pratt Institute-Main,"200 Willoughby Ave, Brooklyn, New York 11205",https://www.pratt.edu/,Information Unavailable,Information Unavailable,Information Unavailable,Information Unavailable,"4-year, Private not-for-profit",-
Pratt Manhattan-A Division of Pratt Institute,"144 West 14th Street, New York, New York 10011",https://www.pratt.edu/,Information Unavailable,Information Unavailable,Information Unavailable,Information Unavailable,"4-year, Private not-for-profit",-
PrattMWP College of Art and Design,"Utica, NY",https://www.collegexpress.com/college/prattmwp-college-of-art-and-design/3302617/details/,"$32,210",Information Unavailable,10:1,"Pratt at Munson Williams Proctor Arts Institute, founded in 1919, is a small art college offering the first two years of a bachelor's degree with the last two years at the Pratt Institute in Brooklyn, NY. Its campus is located in Utica, NY.",Information Unavailable,Information Unavailable
Professional Culinary Academy,"875 Elmwood Avenue, Buffalo, New York 14222-1433",professionalculinaryacademy.com/,Information Unavailable,Information Unavailable,Information Unavailable,Information Unavailable,"< 2-year, Private for-profit","Culinary Arts and Related Services, Other"
Purchase College,"Purchase, NY",https://www.collegexpress.com/college/purchase-college/1100161/details/,"$7,070",73%,14:1,"Purchase College, SUNY, founded in 1967, is a public college and part of the State University of New York system. Located 25 miles north of Manhattan in Westchester County, the campus sits on a 500-plus acre estate and offers programs in the School of the Arts, the School of Liberal Arts and Sciences, and the School of Liberal Studies and Continuing Education.",Information Unavailable,Information Unavailable
"Queens College, CUNY","Queens, NY",https://www.collegexpress.com/college/queens-college-cuny/1100946/details/,"$6,930",53%,16:1,"Founded in 1937, Queens College is a public coeducational liberal arts institution in the City University of New York school system. Its 80-acre campus is located in the Flushing section of Queens in New York.",Information Unavailable,Information Unavailable
Queensborough Community College,"Bayside, NY",https://www.collegexpress.com/college/queensborough-community-college/3300977/details/,"$4,800",Information Unavailable,19:1,"Queensborough Community College, founded in 1959, is a public two-year institution. Its 34-acre campus is located in Bayside, NY.",Information Unavailable,Information Unavailable
Rabbinical Academy Mesivta Rabbi Chaim Berlin,"1593 Coney Island Ave, Brooklyn, New York 11230",https://rabbinicalacademyrabbichaimberlin.com/,Information Unavailable,Information Unavailable,Information Unavailable,Information Unavailable,"4-year, Private not-for-profit",-
Rabbinical College Beth Shraga,"28 Saddle River Rd, Monsey, New York 10952-3033",https://rabbinicalcollegebethshraga.com/,Information Unavailable,Information Unavailable,Information Unavailable,Information Unavailable,"4-year, primarily associate's, Private not-for-profit",-
Rabbinical College Bobover Yeshiva Bnei Zion,"1577 48th St, Brooklyn, New York 11219",rabbinicalcollegeboboveryeshiva.edu/,Information Unavailable,Information Unavailable,Information Unavailable,Information Unavailable,"4-year, Private not-for-profit",-
Rabbinical College Ohr Yisroel,"8800 Seaview Ave, Brooklyn, New York 11236",www.rabbinicalcollegeohryisroel.com/,Information Unavailable,Information Unavailable,Information Unavailable,Information Unavailable,"4-year, Private not-for-profit",-
Rabbinical College of Long Island,"205 W Beech Street, Long Beach, New York 11561",https://rabbinicalcollegelongisland.com/,Information Unavailable,Information Unavailable,Information Unavailable,Information Unavailable,"4-year, primarily associate's, Private not-for-profit",-
Rabbinical College of Ohr Shimon Yisroel,"215-217 Hewes St, Brooklyn, New York 11211",https://ohr-sy.com/,Information Unavailable,Information Unavailable,Information Unavailable,Information Unavailable,"4-year, Private not-for-profit",-
Rabbinical Seminary of America,"76-01 147th St, Flushing, New York 11367",www.rabbinical.org/,Information Unavailable,Information Unavailable,Information Unavailable,Information Unavailable,"4-year, Private not-for-profit",-
Rabbinical Seminary of America-Ma'yan HaTorah,"113-25 Myrtle Ave, Richmond Hill, New York 11418",Information Unavailable,Information Unavailable,Information Unavailable,Information Unavailable,Information Unavailable,"4-year, Private not-for-profit",-
Relay Graduate School of Education,"25 Broadway, 3rd Fl, New York, New York 10004",www.relay.edu/,Information Unavailable,Information Unavailable,Information Unavailable,Information Unavailable,"4-year, Private not-for-profit",-
Rensselaer Polytechnic Institute,"Troy, NY",https://www.collegexpress.com/college/rensselaer-polytechnic-institute/1100089/details/,"$55,600",57%,12:1,"Rensselaer Polytechnic Institute, founded in 1824, is a private, technical institution. Programs are offered through the Schools of Architecture, Engineering, Humanities Arts &amp; Social Sciences, Management, and Science. Its 260-acre campus is located in Troy, 15 miles from Albany.","4-year, Private not-for-profit",-
Roberts Wesleyan College,"Rochester, NY",https://www.collegexpress.com/college/roberts-wesleyan-college/1100145/details/,"$32,322",75%,11:1,"Founded in 1866, Roberts Wesleyan College is a private Christian liberal arts college. Its 188-acre campus is located eight miles from downtown Rochester.",Information Unavailable,Information Unavailable
Roberts Wesleyan University,"2301 Westside Dr, Rochester, New York 14624",www.roberts.edu/,Information Unavailable,Information Unavailable,Information Unavailable,Information Unavailable,"4-year, Private not-for-profit",-
Rochester Institute of Technology,"Rochester, NY",https://www.collegexpress.com/college/rochester-institute-of-technology/1100157/details/,"$50,564",73%,13:1,"Rochester Institute of Technology, founded in 1829, is a private, coeducational institution. Its 1,300-acre campus is located in Rochester, 75 miles from Buffalo and 97 miles from Syracuse, with branch campuses abroad in China, Croatia, Dubai, and Kosovo.","4-year, Private not-for-profit",-
Rockland Community College,"Suffern, NY",https://www.collegexpress.com/college/rockland-community-college/3300997/details/,"$5,110",Information Unavailable,Information Unavailable,"Rockland Community College, founded in 1959, is a public two-year institution. Its 120-acre campus is located in Suffern, NY.","2-year, Public",-
Rockland County BOCES-Practical Nursing Program,"65 Parrott Rd, Bldg 3, West Nyack, New York 10994",www.rocklandboces.org/programs-for-students/adult-education/practical-nursing,Information Unavailable,Information Unavailable,Information Unavailable,Information Unavailable,"< 2-year, Public",Licensed Practical/Vocational Nurse Training
Russell Sage College,"Troy, NY",https://www.collegexpress.com/college/russell-sage-college/1100208/details/,"$31,450",74%,11:1,"Russell Sage College (formerly The Sage Colleges), is a four-year college  specializing in the arts and sciences and professional fields of study with two campuses in Troy and Albany, NY. Both campuses offer both undergraduate and graduate degree programs and courses.","4-year, Private not-for-profit",-
SAE Institute of Technology-New York,"218 West 18th St Fl 4, New York, New York 10011-4552",https://usa.sae.edu/campuses/new-york/,Information Unavailable,Information Unavailable,Information Unavailable,Information Unavailable,"< 2-year, Private for-profit",-
SAGE Truck Driving School — New York,"Endicott, NY",https://www.collegexpress.com/college/sage-truck-driving-school-new-york/3303649/details/,Information Unavailable,Information Unavailable,Information Unavailable,Information Unavailable,Information Unavailable,Information Unavailable
SAGE Truck Driving School — Rome,"Rome, NY",https://www.collegexpress.com/college/sage-truck-driving-school-rome/3303727/details/,Information Unavailable,Information Unavailable,Information Unavailable,Information Unavailable,Information Unavailable,Information Unavailable
SUNY Adirondack,"Queensbury, NY",https://www.collegexpress.com/college/suny-adirondack/3301630/details/,"$4,944",Information Unavailable,20:1,"Founded in 1961, SUNY Adirondack is a public community liberal arts college. Its campus is located in Queensbury, New York.","2-year, Public",-
SUNY Brockport,"Brockport, NY",https://www.collegexpress.com/college/suny-brockport/1100135/details/,"$7,070",58%,17:1,"SUNY Brockport, founded in 1835, is a public, comprehensive four-year college. Its 464-acre campus is located in Brockport, NY: 16 miles west of Rochester, NY, 45 miles east of Buffalo, NY, and a short drive from the Canadian border.","4-year, Public",-
SUNY Broome Community College,"Binghamton, NY",https://www.collegexpress.com/college/suny-broome-community-college/3300955/details/,"$5,088",Information Unavailable,Information Unavailable,"Broome Community College is a public, comprehensive community college supervised the the State University of New York, sponsored by the County of Broome, and governed by a Board of Trustees. Chartered in 1946 Broome Community College's 220-acre campus is located in BInghamton, New York.","2-year, Public",-
SUNY Buffalo State University,"1300 Elmwood Ave, Buffalo, New York 14222",https://suny.buffalostate.edu/,Information Unavailable,Information Unavailable,Information Unavailable,Information Unavailable,"4-year, Public",-
SUNY Canton,"Canton, NY",https://www.collegexpress.com/college/suny-canton/5009129/details/,"$7,070",83%,18:1,"Founded in 1906, SUNY Canton is a public coeducational residential college located on a 555-acre campus along the banks of the Grasse River in Canton, New York.",Information Unavailable,Information Unavailable
SUNY Cobleskill,"Cobleskill, NY",https://www.collegexpress.com/college/suny-cobleskill/3000130/details/,"$7,070",80%,16:1,"Founded in 1911, SUNY Cobleskill is a public polytechnic college with a rich academic tradition spanning over 100 years. Over 2,300 students are enrolled in the 58 certificate, associate, and baccalaureate degree programs offered.  Its 902-acre campus is located in Cobleskill, 35 miles from Albany.",Information Unavailable,Information Unavailable
SUNY College at Geneseo,"1 College Circle, Geneseo, New York 14454-1465",https://www.geneseo.edu/,Information Unavailable,Information Unavailable,Information Unavailable,Information Unavailable,"4-year, Public",-
SUNY College at Plattsburgh,"101 Broad Street, Plattsburgh, New York 12901-2681",https://www.plattsburgh.edu/,Information Unavailable,Information Unavailable,Information Unavailable,Information Unavailable,"4-year, Public",-
SUNY College at Potsdam,"44 Pierrepont Ave, Potsdam, New York 13676-2294",www.potsdam.edu/,Information Unavailable,Information Unavailable,Information Unavailable,Information Unavailable,"4-year, Public",-
SUNY College of Agriculture and Technology at Cobleskill,"State Route 7, Cobleskill, New York 12043",www.cobleskill.edu/,Information Unavailable,Information Unavailable,Information Unavailable,Information Unavailable,"4-year, Public",-
SUNY College of Environmental Science and Forestry,"Syracuse, NY",https://www.collegexpress.com/college/suny-college-of-environmental-science-and-forestry/1100142/details/,"$7,070",60%,13:1,"SUNY College of Environmental Science and Forestry, founded in 1911, is a public, multipurpose college. Its 12-acre campus is located in Syracuse.","4-year, Public",-
SUNY College of Optometry,"33 West 42nd Street, New York, New York 10036-8003",www.sunyopt.edu/,Information Unavailable,Information Unavailable,Information Unavailable,Information Unavailable,"4-year, Public",-
SUNY College of Technology at Alfred,"10 Upper College Drive, Alfred, New York 14802",www.alfredstate.edu/,Information Unavailable,Information Unavailable,Information Unavailable,Information Unavailable,"4-year, primarily associate's, Public",-
SUNY College of Technology at Canton,"34 Cornell Drive, Canton, New York 13617-1098",www.canton.edu/,Information Unavailable,Information Unavailable,Information Unavailable,Information Unavailable,"4-year, Public",-
SUNY College of Technology at Delhi,"454 Delhi Drive, Delhi, New York 13753-1100",www.delhi.edu/,Information Unavailable,Information Unavailable,Information Unavailable,Information Unavailable,"4-year, Public",-
SUNY Corning Community College,"Corning, NY",https://www.collegexpress.com/college/suny-corning-community-college/3300983/details/,"$5,068",Information Unavailable,Information Unavailable,"Corning Community College, founded in 1956, is a public, coeducational, two-year institution. Its campus is located in Corning, NY.","2-year, Public",-
SUNY Cortland,"Cortland, NY",https://www.collegexpress.com/college/suny-cortland/1100140/details/,"$7,070",52%,16:1,"SUNY Cortland, founded in 1868, is a public, multipurpose college of arts and sciences. Its 191-acre campus is located in Cortland, 30 miles from Syracuse.",Information Unavailable,Information Unavailable
SUNY Delhi,"Delhi, NY",https://www.collegexpress.com/college/suny-delhi/3300952/details/,"$7,070",64%,15:1,"SUNY--Delhi, founded in 1913, is a public, coeducational institution offering degrees ranging from the Certificate to Master's level.  Its campus is located in Delhi, New York.",Information Unavailable,Information Unavailable
SUNY Downstate Health Sciences University,"450 Clarkson Ave, Brooklyn, New York 11203-2098",https://www.downstate.edu/,Information Unavailable,Information Unavailable,Information Unavailable,Information Unavailable,"4-year, Public",-
SUNY Empire State College,"Saratoga Springs, NY",https://www.collegexpress.com/college/suny-empire-state-college/3000011/details/,"$7,070",Information Unavailable,15:1,"SUNY Empire State College, founded in 1971, is a public, coeducational institution. Its campus is located in Saratoga Springs, New York.",Information Unavailable,Information Unavailable
SUNY Fredonia,"Fredonia, NY",https://www.collegexpress.com/college/suny-fredonia/1100143/details/,"$7,070",72%,14:1,"State University of New York at Fredonia is a public comprehensive selective liberal arts university in western New York, just minutes from Lake Erie. Founded in 1826, the university is among the oldest in the SUNY system.",Information Unavailable,Information Unavailable
SUNY Geneseo,"Geneseo, NY",https://www.collegexpress.com/college/suny-geneseo/1100146/details/,"$7,070",61%,17:1,"SUNY Geneseo, founded in 1871, is a public, multipurpose college of liberal arts and sciences. Its 220-acre campus is located in Geneseo, NY, 30 miles south of Rochester.",Information Unavailable,Information Unavailable
SUNY Maritime College,"Throggs Neck, NY",https://www.collegexpress.com/college/suny-maritime-college/1100167/details/,"$7,070",72%,Information Unavailable,"SUNY Maritime College, founded in 1874, is a public, multipurpose college for the maritime and related industries. Its 56-acre campus is located in Throggs Neck.","4-year, Public",-
SUNY Morrisville,"Morrisville, NY",https://www.collegexpress.com/college/suny-morrisville/5009395/details/,"$7,070",Information Unavailable,Information Unavailable,"SUNY Morrisville, founded in 1908, is a public, coeducational institution. Its campus is located in Morrisville, NY.","4-year, primarily associate's, Public",-
SUNY New Paltz,"New Paltz, NY",https://www.collegexpress.com/college/suny-new-paltz/1100148/details/,"$7,070",62%,16:1,"Founded in 1828, SUNY New Paltz is a public multipurpose institution of arts and sciences. Its 216-acre campus is located in New Paltz, 75 miles from Albany.",Information Unavailable,Information Unavailable
SUNY Old Westbury,"Old Westbury, NY",https://www.collegexpress.com/college/suny-old-westbury/1100149/details/,"$7,070",53%,18:1,"SUNY College at Old Westbury, founded in 1965, is a comprehensive public college offering undergraduate and graduate degrees. With a wooded 604-acre campus centrally located on Long Island, the nation's 17th largest population center, Old Westbury offers the best of both worlds -- a quiet atmosphere dedicated to learning, yet just 20 miles from the heart of New York City.","4-year, Public",-
SUNY Oneonta,"Oneonta, NY",https://www.collegexpress.com/college/suny-oneonta/1100151/details/,"$7,070",62%,17:1,"SUNY Oneonta, founded in 1889, is a public, multipurpose university of liberal arts and sciences. Its 250-acre campus is located in Oneonta, 75 miles southwest of Albany.","4-year, Public",-
SUNY Oswego,"Oswego, NY",https://www.collegexpress.com/college/suny-oswego/1100153/details/,"$7,070",68%,17:1,"SUNY Oswego, founded in 1861, is a public, multipurpose college of arts and sciences. Its 696-acre campus is located in Oswego, 35 miles northwest of Syracuse, on the shore of Lake Ontario.",Information Unavailable,Information Unavailable
SUNY Plattsburgh,"Plattsburgh, NY",https://www.collegexpress.com/college/suny-plattsburgh/1100155/details/,"$7,070",61%,16:1,"SUNY Plattsburgh, founded in 1889, is a public, multipurpose college of arts and sciences. Its 300-acre campus is located in Plattsburgh, 60 miles from Montreal, Canada.",Information Unavailable,Information Unavailable
SUNY Polytechnic Institute,"Utica and Albany, NY",https://www.collegexpress.com/college/suny-polytechnic-institute/1100163/details/,"$7,070",73%,13:1,"SUNY Polytechnic Institute, founded in 1966, is a public institute of technology. It has campuses in Utica and Albany, New York.","4-year, Public",-
SUNY Potsdam,"Potsdam, NY",https://www.collegexpress.com/college/suny-potsdam/1100159/details/,"$7,070",71%,11:1,"SUNY Potsdam, founded in 1816, is a public, liberal arts college. Its 240-acre campus is located in Potsdam NY, north of Syracuse.",Information Unavailable,Information Unavailable
SUNY Sullivan,"Loch Sheldrake, NY",https://www.collegexpress.com/college/suny-sullivan/3301000/details/,"$5,208",Information Unavailable,18:1,"Sullivan County Community College, founded in 1963, is a public two-year institution. Its 405-acre campus is located in Loch Sheldrake, NY.",Information Unavailable,Information Unavailable
SUNY Ulster,"Stone Ridge, NY",https://www.collegexpress.com/college/suny-ulster/3303908/details/,"$4,880",Information Unavailable,Information Unavailable,"SUNY Ulster is a public two-year institution. Its campus is located in Stone Ridge, NY.",Information Unavailable,Information Unavailable
SUNY Upstate Medical University,"Syracuse, NY",https://www.collegexpress.com/college/suny-upstate-medical-university/1100169/details/,Information Unavailable,Information Unavailable,Information Unavailable,"SUNY Upstate Medical University, founded in 1950, is a public, comprehensive institution. Its 30-acre campus is located in downtown Syracuse.",Information Unavailable,Information Unavailable
SUNY Westchester Community College,"75 Grasslands Road, Valhalla, New York 10595",www.sunywcc.edu/,Information Unavailable,Information Unavailable,Information Unavailable,Information Unavailable,"2-year, Public",-
SUNY at Fredonia,"280 Central Ave, Fredonia, New York 14063-1136",https://www.fredonia.edu/,Information Unavailable,Information Unavailable,Information Unavailable,Information Unavailable,"4-year, Public",-
SUNY at Purchase College,"735 Anderson Hill Rd, Purchase, New York 10577-1400",www.purchase.edu/,Information Unavailable,Information Unavailable,Information Unavailable,Information Unavailable,"4-year, Public",-
Saint Elizabeth College of Nursing,"2215 Genesee Street, Utica, New York 13501",https://www.secon.edu/,Information Unavailable,Information Unavailable,Information Unavailable,Information Unavailable,"2-year, Private not-for-profit",-
Saint John's University - Staten Island Campus,"300 Howard Avenue, Staten Island, New York 10301-4496",www.stjohns.edu/campuses/staten-island-campus,Information Unavailable,Information Unavailable,Information Unavailable,Information Unavailable,"4-year, Private not-for-profit",-
