Name,Location,Website,Tuition,Acceptance Rate,Student-Faculty Ratio,Description,School Type,Largest Program
Empire Beauty School-Rochester,"340 Elmridge Center Drive, Rochester, New York 14626-3461",www.empire.edu/,Information Unavailable,Information Unavailable,Information Unavailable,Information Unavailable,"< 2-year, Private for-profit","Cosmetology/Cosmetologist, General"
Empire State University,"Two Union Ave, Saratoga Springs, New York 12866-4391",www.sunyempire.edu/,Information Unavailable,Information Unavailable,Information Unavailable,Information Unavailable,"4-year, Public",-
Erie 1 BOCES,"355 Harlem Rd, West Seneca, New York 14224",e1b.org/WFD,Information Unavailable,Information Unavailable,Information Unavailable,Information Unavailable,"< 2-year, Public",Licensed Practical/Vocational Nurse Training
Erie 2 Chautauqua Cattaraugus BOCES-Practical Nursing Program,"8685 Erie Rd, Angola, New York 14006",www.e2ccb.org/,Information Unavailable,Information Unavailable,Information Unavailable,Information Unavailable,"< 2-year, Public",Licensed Practical/Vocational Nurse Training
Erie Community College,"121 Ellicott St, Buffalo, New York 14203-2698",www.ecc.edu/,Information Unavailable,Information Unavailable,Information Unavailable,Information Unavailable,"2-year, Public",-
Erie Community College—City Campus,"Buffalo, NY",https://www.collegexpress.com/college/erie-community-college-city-campus/3300958/details/,"$5,047",Information Unavailable,15:1,"Founded in 1971, Erie Community College—City Campus is a public two-year liberal arts college. Its campus is located in Buffalo, New York.",Information Unavailable,Information Unavailable
Erie Community College—North Campus,"Williamsville, NY",https://www.collegexpress.com/college/erie-community-college-north-campus/3300956/details/,"$4,900",74%,16:1,"Founded in 1946, Erie Community College—North Campus is a public two-year liberal arts college. Its 120-acre campus is located in Williamsville, New York.",Information Unavailable,Information Unavailable
Erie Community College—South Campus,"Orchard Park, NY",https://www.collegexpress.com/college/erie-community-college-south-campus/3300957/details/,"$4,900",84%,13:1,"Founded in 1974, Erie Community College—South Campus is a public two-year institution. Its campus is located in Orchard Park, NY.",Information Unavailable,Information Unavailable
Eugene Lang College of Liberal Arts at The New School,"New York, NY",https://www.collegexpress.com/college/eugene-lang-college-of-liberal-arts-at-the-new-school/1100772/details/,"$50,406",69%,11:1,"Founded in 1985, Eugene Lang College of Liberal Arts at The New School is a private coeducational institution. Its five-acre, urban campus is located in the Greenwich Village area of New York City",Information Unavailable,Information Unavailable
Excelsior College,"Albany, NY",https://www.collegexpress.com/college/excelsior-college/3000168/details/,Information Unavailable,Information Unavailable,Information Unavailable,"Founded in 1971, Excelsior College provides innovative and rigorous distance learning academic programs to adult learners. Accredited by Middle States, Excelsior offers 58 undergraduate and 3 graduate degree. Excelsior serves over 30,000 enrolled students in both its assessment and instruction based programs.",Information Unavailable,Information Unavailable
Excelsior University,"7 Columbia Cir, Albany, New York 12203-5159",www.excelsior.edu/,Information Unavailable,Information Unavailable,Information Unavailable,Information Unavailable,"4-year, Private not-for-profit",-
Farmingdale State College,"Farmingdale, NY",https://www.collegexpress.com/college/farmingdale-state-college/1101080/details/,"$7,070",60%,19:1,"Farmingdale State College, founded in 1912, is a public college of technology and applied sciences. Its 380-acre campus is located in Farmingdale on Long Island, 35 miles from New York City.","4-year, Public",-
Fashion Institute of Technology,"New York, NY",https://www.collegexpress.com/college/fashion-institute-of-technology/1100515/details/,"$5,290",58%,16:1,"The Fashion Institute of Technology, founded in 1944, is a school of art and design and business and technology. It is a public institution, receiving its principal financial support from the State and City of New York. Its five-acre campus is located in midtown Manhattan, near the center of New York's fashion industry.","4-year, primarily associate's, Public",-
Finger Lakes Community College,"Canandaigua, NY",https://www.collegexpress.com/college/finger-lakes-community-college/3300982/details/,"$4,864",Information Unavailable,Information Unavailable,"Finger Lakes Community College, founded in 1965, is a public, coeducational, two-year institution. Its campus is located in Canandaigua, NY.","2-year, Public",-
Finger Lakes Health College of Nursing & Health Sciences,"196 North Street, Geneva, New York 14456-1651",https://www.flhcon.edu/,Information Unavailable,Information Unavailable,Information Unavailable,Information Unavailable,"2-year, Private not-for-profit",-
Five Towns College,"Dix Hills, NY",https://www.collegexpress.com/college/five-towns-college/3000000/details/,"$24,900",47%,Information Unavailable,"Five Town College, founded in 1972, is a private coeducational institution. Its 35-acre campus is located in Dix Hills, 25 miles from New York City.","4-year, Private for-profit",-
Focus Personal Training Institute,"115 West 27th Street, 11th Floor, New York, New York 10001-6217",www.fpti.edu/,Information Unavailable,Information Unavailable,Information Unavailable,Information Unavailable,"< 2-year, Private for-profit",Physical Fitness Technician
Fordham University,"Bronx, NY",https://www.collegexpress.com/college/fordham-university/1100929/details/,"$54,730",52%,15:1,"Fordham University is the Jesuit University of New York.  Founded in 1841, our  85-acre Rose Hill campus is located in the Bronx, adjacent to the Botanical Gardens and Bronx Zoo. Our eight-acre Lincoln Center campus is located in Manhattan, right next to the Lincoln Center arts complex.","4-year, Private not-for-profit",-
Fulton-Montgomery Community College,"2805 State Hwy 67, Johnstown, New York 12095-3790",www.fmcc.edu/,Information Unavailable,Information Unavailable,Information Unavailable,Information Unavailable,"2-year, Public",-
Fulton–Montgomery Community College,"Johnstown, NY",https://www.collegexpress.com/college/fulton-montgomery-community-college/3300959/details/,"$5,040",Information Unavailable,Information Unavailable,"Founded in 1963, Fulton-Montgomery Community College,  is a public two-year coeducational institution. Its campus is located in Johnstown, NY.",Information Unavailable,Information Unavailable
Gemological Institute of America New York,"New York, NY",https://www.collegexpress.com/college/gemological-institute-of-america-new-york/3101034/details/,Information Unavailable,Information Unavailable,Information Unavailable,"Gemological Institute of America, founded in 1931, is a private two-year professional institution. Its campus is located in New York, NY.",Information Unavailable,Information Unavailable
Gemological Institute of America-New York,"50 West 47th Street, 8th Floor, New York, New York 10036",www.gia.edu/gem-education,Information Unavailable,Information Unavailable,Information Unavailable,Information Unavailable,"< 2-year, Private not-for-profit",Jewelry Arts
Genesee Community College,"Batavia, NY",https://www.collegexpress.com/college/genesee-community-college/3300986/details/,"$4,550",Information Unavailable,Information Unavailable,"Genesee Community College, founded in 1966, is a public, two-year, liberal arts institution. Its 250-acre campus is located in Batavia, NY.","2-year, Public",-
Genesee Valley BOCES-Practical Nursing Program,"Adult Education Office  8250 State St Rd, Batavia, New York 14020",www.gvboces.org/,Information Unavailable,Information Unavailable,Information Unavailable,Information Unavailable,"< 2-year, Public",Licensed Practical/Vocational Nurse Training
Glasgow Caledonian New York College,"64 Wooster Street, New York, New York 10012",www.gcnyc.edu/,Information Unavailable,Information Unavailable,Information Unavailable,Information Unavailable,"4-year, Private not-for-profit",-
Grace International Beauty School,"136-31 41st Avenue, #6FL, Flushing, New York 11355-2446",www.gibs.edu/,Information Unavailable,Information Unavailable,Information Unavailable,Information Unavailable,"< 2-year, Private for-profit","Cosmetology/Cosmetologist, General"
Guttman Community College,"New York, NY",https://www.collegexpress.com/college/guttman-community-college/200000060/details/,"$4,800",Information Unavailable,15:1,Guttman Community College is a public liberal arts community college in New York City. It's the newest of the City University of New York (CUNY) school system community colleges and was founded in September of 2012.,Information Unavailable,Information Unavailable
HJ International Graduate School for Peace and Public Leadership,"4 West 43rd Street, New York, New York 10036",https://www.uts.edu/,Information Unavailable,Information Unavailable,Information Unavailable,Information Unavailable,"4-year, Private not-for-profit",-
Hamilton College,"Clinton, NY",https://www.collegexpress.com/college/hamilton-college/2100323/details/,"$57,930",18%,9:1,"Hamilton College is a private, liberal arts college. Founded in 1812, it adopted coeducation in 1978. Its 1,300-acre campus is located in Clinton, nine miles from Utica.","4-year, Private not-for-profit",-
Harlem School of Technology,"New York, NY",https://www.collegexpress.com/college/harlem-school-of-technology/3303571/details/,Information Unavailable,Information Unavailable,Information Unavailable,"Harlem School of Technology is a private, two-year technical institution. Its campus is located in New York, NY.",Information Unavailable,Information Unavailable
Hartwick College,"Oneonta, NY",https://www.collegexpress.com/college/hartwick-college/1100524/details/,"$47,370",93%,10:1,"Hartwick College, founded in 1797, is a private liberal arts and sciences college. The 425-acre campus is located in Oneonta, New York.","4-year, Private not-for-profit",-
Hebrew Union College-Jewish Institute of Religion,"One W 4th St, New York, New York 10012-1186",www.huc.edu/,Information Unavailable,Information Unavailable,Information Unavailable,Information Unavailable,"4-year, Private not-for-profit",-
Helene Fuld College of Nursing,"New York, NY",https://www.collegexpress.com/college/helene-fuld-college-of-nursing/3302594/details/,Information Unavailable,Information Unavailable,Information Unavailable,"Helen Fuld College of Nursing, founded in 1945, is a private, specialized institution. Its campus is located in New York.","4-year, primarily associate's, Private not-for-profit",-
Herkimer County BOCES-Practical Nursing Program,"420 East German Sterr, Herkimer, New York 13350",https://www.herkimer-boces.org/page/adult-practical-nursing,Information Unavailable,Information Unavailable,Information Unavailable,Information Unavailable,"< 2-year, Public",Licensed Practical/Vocational Nurse Training
Herkimer County Community College,"Herkimer, NY",https://www.collegexpress.com/college/herkimer-county-community-college/3300987/details/,"$5,016",Information Unavailable,Information Unavailable,"Herkimer County Community College, founded in 1967, is a public two-year institution. Its 500-acre campus is located in Herkimer, NY.","2-year, Public",-
Hilbert College,"Hamburg, NY",https://www.collegexpress.com/college/hilbert-college/3000088/details/,"$23,495",91%,12:1,"Hilbert College is a private, Catholic, Franciscan college. Founded in 1957, it adopted coeducation in 1969. Its 49-acre campus is located in the town of Hamburg, 10 miles from Buffalo.","4-year, Private not-for-profit",-
Hobart William Smith Colleges,"337 Pulteney Street, Geneva, New York 14456",www.hws.edu/,Information Unavailable,Information Unavailable,Information Unavailable,Information Unavailable,"4-year, Private not-for-profit",-
Hobart and William Smith Colleges,"Geneva, NY",https://www.collegexpress.com/college/hobart-and-william-smith-colleges/2100326/details/,"$57,400",61%,10:1,"Hobart College, founded in 1822, is a private liberal arts college for men. Coordinate college, William Smith, founded in 1908, is a private liberal arts college for women. Its 200-acre combined campus is located in Geneva.",Information Unavailable,Information Unavailable
Hofstra University,"Hempstead, NY",https://www.collegexpress.com/college/hofstra-university/2100327/details/,"$48,315",69%,13:1,"Hofstra University, founded in 1935, is a private university. Its 240-acre campus is located in Hempstead, 25 miles east of New York City.","4-year, Private not-for-profit",-
Hostos Community College,"Bronx, NY",https://www.collegexpress.com/college/hostos-community-college/3301622/details/,"$4,800",Information Unavailable,Information Unavailable,"Hostos Community College, founded in 1968, is a public, specialized, coeducational institution. Its campus is located in Bronx, NY.",Information Unavailable,Information Unavailable
Houghton University,"Houghton, NY",https://www.collegexpress.com/college/houghton-university/2100351/details/,"$33,920",79%,12:1,"Founded in 1883, Houghton University is a private coeducational Christian institution of the liberal arts and sciences. Its 1,300-acre campus is located in Houghton, NY, 60 miles from Buffalo and 70 miles from Rochester.","4-year, Private not-for-profit",-
Hudson Valley Community College,"Troy, NY",https://www.collegexpress.com/college/hudson-valley-community-college/3300988/details/,"$4,800",Information Unavailable,19:1,"Hudson Valley Community College, founded in 1953, is a public two-year institution. Its 154-acre campus is located in Troy, NY.","2-year, Public",-
Hunter Business School,"Levittown, NY",https://www.collegexpress.com/college/hunter-business-school/3101037/details/,Information Unavailable,Information Unavailable,Information Unavailable,"Hunter Business School is a private, two-year, professional institution. Its campus is located in Levittown, NY.","2-year, Private for-profit",Medical/Clinical Assistant
"Hunter College, CUNY","New York, NY",https://www.collegexpress.com/college/hunter-college-cuny/1100566/details/,"$6,930",40%,14:1,"Founded in 1870, Hunter College is a public institution and part of the City University of New York system. Its three-block campus is located in New York City.",Information Unavailable,Information Unavailable
Icahn School of Medicine at Mount Sinai,"One Gustave L Levy Place, Box 1217, New York, New York 10029-6574",icahn.mssm.edu/,Information Unavailable,Information Unavailable,Information Unavailable,Information Unavailable,"4-year, Private not-for-profit",-
Institute of Culinary Education,"225 Liberty Street, New York, New York 10281",https://www.ice.edu/,Information Unavailable,Information Unavailable,Information Unavailable,Information Unavailable,"< 2-year, Private for-profit",Culinary Arts/Chef Training
Iona University,"New Rochelle, NY",https://www.collegexpress.com/college/iona-university/2100348/details/,"$39,380",85%,16:1,"Iona University is a coeducational Roman Catholic liberal arts institution founded in 1940 in the tradition of the Christian Brothers. Programs are offered through the Schools of Arts and Sciences and Business. Its 45-acre campus is located in New Rochelle on Long Island Sound, 16 miles from New York City.","4-year, Private not-for-profit",-
Isabella Graham Hart School of Practical Nursing,"470 Skyview Centre Pkwy, Rochester, New York 14622",www.rochesterregional.org/for-healthcare-professionals/residency-training-programs/igh-school-of-practical-nursing/,Information Unavailable,Information Unavailable,Information Unavailable,Information Unavailable,"< 2-year, Private not-for-profit",Licensed Practical/Vocational Nurse Training
Island Drafting & Technical Institute,"Amityville, NY",https://www.collegexpress.com/college/island-drafting-technical-institute/3101040/details/,"$16,500",Information Unavailable,Information Unavailable,"Island Drafting and Technical Institute, founded in 1957, is a private, technical institute specializing in computer aided drafting/design technology. Its campus is located in Amityville, New York.",Information Unavailable,Information Unavailable
Island Drafting and Technical Institute,"128 Broadway Rte 110, Amityville, New York 11701-2704",https://www.idti.edu/,Information Unavailable,Information Unavailable,Information Unavailable,Information Unavailable,"2-year, Private for-profit",-
Ithaca College,"Ithaca, NY",https://www.collegexpress.com/college/ithaca-college/1100770/details/,"$46,610",75%,10:1,"Founded in 1892, Ithaca College is a private liberal arts college with programs offered through the Schools of Business, Communications, Health Sciences & Human Performance, Humanities & Sciences, and Music. Its 670-contiguous-acre campus is located in Ithaca, New York—50 miles south of Syracuse.","4-year, Private not-for-profit",-
Jamestown Business College,"Jamestown, NY",https://www.collegexpress.com/college/jamestown-business-college/3101041/details/,"$11,700",97%,Information Unavailable,"Jamestown Business College, founded in 1886, is a private two-year institution. Its campus is located in Jamestown, NY.","4-year, primarily associate's, Private for-profit",-
Jamestown Business College -,"25 Center Street, Salamanca, New York 14779-9740",www.jbc.edu/,Information Unavailable,Information Unavailable,Information Unavailable,Information Unavailable,"4-year, Private for-profit",-
Jamestown Community College,"Jamestown, NY",https://www.collegexpress.com/college/jamestown-community-college/3300989/details/,"$4,870",99%,17:1,"Founded in 1950, Jamestown Community College is a public, two-year college. The main campus is located on a 107-acre site at the foot of Chautauqua Lake in Jamestown, NY. JCC has a branch campus in Olean, NY and extension centers in Dunkirk, NY and Warren, PA. Jamestown Community College is part of the State University of New York (SUNY) system.","2-year, Public",-
Jamestown Community College—Cattaraugus County Campus,"Olean, NY",https://www.collegexpress.com/college/jamestown-community-college-cattaraugus-county-campus/3300960/details/,"$5,200",Information Unavailable,17:1,"Founded in 1950, Jamestown Community College,  is a public two-year college. The main campus is located on a 107-acre site at the foot of Chautauqua Lake in Jamestown, New York. JCC has a branch campus in Olean and extension centers in Dunkirk and Warren, Pennsylvania. Jamestown Community College is part of the State University of New York (SUNY) system.",Information Unavailable,Information Unavailable
Jamestown Community College—North County Center,"Dunkirk, NY",https://www.collegexpress.com/college/jamestown-community-college-north-county-center/3302146/details/,"$4,870",Information Unavailable,16:1,"Founded in 1950, Jamestown Community College is a public two-year college. The main campus is located on a 107-acre site at the foot of Chautauqua Lake in Jamestown, New York. JCC has a branch campus in Olean and extension centers in Dunkirk and Warren, Pennsylvania. Jamestown Community College is part of the State University of New York (SUNY) system.",Information Unavailable,Information Unavailable
Jefferson Community College,"Watertown, NY",https://www.collegexpress.com/college/jefferson-community-college/3300990/details/,"$5,016",Information Unavailable,18:1,"Jefferson Community College, part of the SUNY college system, founded in 1962, is a public, coeducational, two-year institution. Its campus is located in Watertown, NY.","2-year, Public",-
Jefferson Lewis BOCES-Practical Nursing Program,"20104 State Route 3, Watertown, New York 13601-9509",www.boces.com/,Information Unavailable,Information Unavailable,Information Unavailable,Information Unavailable,"< 2-year, Public",-
Jewish Theological Seminary of America,"New York, NY",https://www.collegexpress.com/college/jewish-theological-seminary-of-america/3000167/details/,"$56,128",58%,Information Unavailable,"The Jewish Theological Seminary, founded in 1886, is a private, coeducational Conservative Judaistic college. Its campus is located in New York City.","4-year, Private not-for-profit",-
Joffrey Ballet School,"New York, NY",https://www.collegexpress.com/college/joffrey-ballet-school/3302605/details/,"$20,900",41%,Information Unavailable,"American Ballet Center/Joffrey Ballet School, founded in 1952, is a private, specialized, coeducational institution. Its campus is located in New York.",Information Unavailable,Information Unavailable
John Jay College of Criminal Justice,"New York, NY",https://www.collegexpress.com/college/john-jay-college-of-criminal-justice/2100310/details/,"$6,930",37%,Information Unavailable,"John Jay College of Criminal Justice is a public institution of liberal arts and criminal justice and a senior member of the City University of New York school system. Founded in 1964, it grew out of a program of higher education for New York City police officers. Its campus is located in the Lincoln Center area of Manhattan.",Information Unavailable,Information Unavailable
Juilliard School,"New York, NY",https://www.collegexpress.com/college/juilliard-school/1100766/details/,"$49,260",7%,4:1,"The Juilliard School, founded in 1905, is a private conservatory of the performing arts. Its campus is located at Lincoln Center in New York City.",Information Unavailable,Information Unavailable
Kehilath Yakov Rabbinical Seminary,"340  Illington Road, Ossining, New York 10562",kehilathyakov.com/,Information Unavailable,Information Unavailable,Information Unavailable,Information Unavailable,"4-year, Private not-for-profit",-
Keuka College,"Keuka Park, NY",https://www.collegexpress.com/college/keuka-college/1100777/details/,"$32,700",90%,8:1,"Keuka College, founded in 1890, is a private, liberal arts institution. Its 288-acre campus is located in  Keuka Park, 50 miles from Rochester.","4-year, Private not-for-profit",-
Kingsborough Community College,"Brooklyn, NY",https://www.collegexpress.com/college/kingsborough-community-college/3300975/details/,"$4,800",Information Unavailable,Information Unavailable,"Kingsborough Community College, founded in 1963, is a public, coeducational institution. Its campus is located in Brooklyn, New York.",Information Unavailable,Information Unavailable
LIM College,"New York, NY",https://www.collegexpress.com/college/lim-college/1100316/details/,"$27,936",84%,16:1,"LIM College, founded in 1939, is a private, fashion and business centered institution. Its facilities are located in Midown Manhattan.","4-year, Private for-profit",-
LaGuardia Community College,"Long Island City, NY",https://www.collegexpress.com/college/laguardia-community-college/3301624/details/,"$4,800",Information Unavailable,Information Unavailable,"LaGuardia Community College, founded in 1971, is a public, two-year, liberal arts institution. Its 6-acre campus is located in Long Island City, NY.",Information Unavailable,Information Unavailable
Le Moyne College,"Syracuse, NY",https://www.collegexpress.com/college/le-moyne-college/2100337/details/,"$34,910",74%,13:1,"Le Moyne College, founded in 1946, is a liberal arts college in the Catholic, Jesuit tradition. Its 161-acre campus is located in a residential area, minutes from downtown Syracuse.","4-year, Private not-for-profit",-
"Lehman College, CUNY","Bronx, NY",https://www.collegexpress.com/college/lehman-college-cuny/1100932/details/,"$6,930",47%,18:1,"Founded in 1931, Lehman College is a public liberal arts institution that was initially a branch campus of Hunter College; it became a separate CUNY college in 1968. Its 37-acre campus is located in the Bronx.",Information Unavailable,Information Unavailable
Leon Studio One School of Beauty Knowledge,"5385 Main St, Williamsville, New York 14221",www.leonstudioone.com/school/,Information Unavailable,Information Unavailable,Information Unavailable,Information Unavailable,"< 2-year, Private for-profit","Cosmetology/Cosmetologist, General"
Lia Schorr Institute of Cosmetic Skin Care Training,"57 west 57 street suite 1409, New York, New York 10019",www.liaschorrinstitute.com/,Information Unavailable,Information Unavailable,Information Unavailable,Information Unavailable,"< 2-year, Private for-profit",Aesthetician/Esthetician and Skin Care Specialist
Lincoln Technical Institute-Whitestone,"15-30 Petracca Pl, Whitestone, New York 11357",www.lincolntech.edu/campus/queens-ny,Information Unavailable,Information Unavailable,Information Unavailable,Information Unavailable,"< 2-year, Private for-profit",Automobile/Automotive Mechanics Technology/Technician
Long Island Beauty School-Hauppauge,"544 Rte 111, Hauppauge, New York 11788",www.libs.edu/,Information Unavailable,Information Unavailable,Information Unavailable,Information Unavailable,"< 2-year, Private for-profit","Cosmetology/Cosmetologist, General"
Long Island Beauty School-Hempstead,"173-A  Fulton Ave, Hempstead, New York 11550",www.libs.edu/,Information Unavailable,Information Unavailable,Information Unavailable,Information Unavailable,"< 2-year, Private for-profit","Cosmetology/Cosmetologist, General"
Long Island Business Institute,"Commack, NY",https://www.collegexpress.com/college/long-island-business-institute/3101046/details/,"$8,866",81%,Information Unavailable,"Long Island Business Institute, founded in 1968, is a private two-year institution. Its 1-acre campus is located in Commack, NY.","2-year, Private for-profit",-
Long Island Nail Skin & Hair Institute,"1055 Stewart Avenue, Bethpage, New York 11714",www.nailskinhairinstitute.edu/,Information Unavailable,Information Unavailable,Information Unavailable,Information Unavailable,"< 2-year, Private for-profit",Aesthetician/Esthetician and Skin Care Specialist
